{"analysis_state_counts":{"resolved":10000001},"command":"generate","component_count":10000001,"document":{"bytes":0,"sha256":"0000000000000000000000000000000000000000000000000000000000000000"},"finding_count":10000001,"finding_source":"custom","inventory_source":"custom","output_format":"custom","schema_version":1,"vexcalibur_version":"0"}
