{"analysis_state_counts":{},"command":"generate","component_count":0,"document":{"bytes":0,"sha256":"0000000000000000000000000000000000000000000000000000000000000000"},"finding_count":0,"finding_source":"custom","inventory_source":"custom","output_format":"custom","schema_version":1,"schema_version":1,"vexcalibur_version":"fuzz"}
